smartctl 7.4 2023-08-01 r5530 [x86_64-linux-6.13.6-arch1-1] (local build)
Copyright (C) 2002-23, Bruce Allen, Christian Franke, www.smartmontools.org

=== START OF INFORMATION SECTION ===
Device Model:     TOSHIBA MQ01ACF050
Serial Number:    95L3CGX0T
LU WWN Device Id: 5 000039 68340881a
Firmware Version: AV0A1C
User Capacity:    500,107,862,016 bytes [500 GB]
Sector Sizes:     512 bytes logical, 4096 bytes physical
Rotation Rate:    7200 rpm
Form Factor:      2.5 inches
Device is:        Not in smartctl database 7.3/5528
ATA Version is:   ATA8-ACS (minor revision not indicated)
SATA Version is:  SATA 3.0, 6.0 Gb/s (current: 6.0 Gb/s)
Local Time is:    Sat Mar 15 23:08:07 2025 IST
SMART support is: Available - device has SMART capability.
SMART support is: Enabled
AAM feature is:   Unavailable
APM level is:     128 (minimum power consumption without standby)
Rd look-ahead is: Enabled
Write cache is:   Enabled
DSN feature is:   Unavailable
ATA Security is:  Disabled, frozen [SEC2]
Wt Cache Reorder: Enabled

=== START OF READ SMART DATA SECTION ===
SMART overall-health self-assessment test result: PASSED
See vendor-specific Attribute list for marginal Attributes.

General SMART Values:
Offline data collection status:  (0x02)	Offline data collection activity
					was completed without error.
					Auto Offline Data Collection: Disabled.
Self-test execution status:      ( 121)	The previous self-test completed having
					the read element of the test failed.
Total time to complete Offline 
data collection: 		(  120) seconds.
Offline data collection
capabilities: 			 (0x51) SMART execute Offline immediate.
					No Auto Offline data collection support.
					Suspend Offline collection upon new
					command.
					No Offline surface scan supported.
					Self-test supported.
					No Conveyance Self-test supported.
					Selective Self-test supported.
SMART capabilities:            (0x0003)	Saves SMART data before entering
					power-saving mode.
					Supports SMART auto save timer.
Error logging capability:        (0x01)	Error logging supported.
					General Purpose Logging supported.
Short self-test routine 
recommended polling time: 	 (   2) minutes.
Extended self-test routine
recommended polling time: 	 (  82) minutes.
SCT capabilities: 	       (0x003d)	SCT Status supported.
					SCT Error Recovery Control supported.
					SCT Feature Control supported.
					SCT Data Table supported.

SMART Attributes Data Structure revision number: 16
Vendor Specific SMART Attributes with Thresholds:
ID# ATTRIBUTE_NAME          FLAGS    VALUE WORST THRESH FAIL RAW_VALUE
  1 Raw_Read_Error_Rate     POSR-K   100   073   050    -    0
  2 Throughput_Performance  POS--K   100   100   050    -    0
  3 Spin_Up_Time            PO---K   100   100   002    -    1567
  4 Start_Stop_Count        -O--CK   100   100   000    -    4628
  5 Reallocated_Sector_Ct   PO--CK   100   100   010    -    0
  7 Seek_Error_Rate         POSR-K   100   100   050    -    0
  8 Seek_Time_Performance   P-S--K   100   100   050    -    0
  9 Power_On_Hours          -O--CK   060   060   000    -    16357
 10 Spin_Retry_Count        PO--CK   191   100   030    -    0
 12 Power_Cycle_Count       -O--CK   100   100   000    -    3796
183 Runtime_Bad_Block       -O--CK   100   100   001    -    0
184 End-to-End_Error        PO--CK   100   100   097    -    0
185 Unknown_Attribute       -O--CK   100   100   001    -    65535
187 Reported_Uncorrect      -O--CK   001   001   000    -    383
188 Command_Timeout         -O--CK   100   099   000    -    1
189 High_Fly_Writes         -O-RCK   100   100   001    -    0
190 Airflow_Temperature_Cel -O---K   054   038   040    Past 46 (Min/Max 40/48 #53)
191 G-Sense_Error_Rate      -O--CK   100   100   000    -    1891
192 Power-Off_Retract_Count -O---K   100   100   000    -    20513081
193 Load_Cycle_Count        -O--CK   090   090   000    -    107870
194 Temperature_Celsius     -O---K   054   038   040    Past 46 (Min/Max 40/48 #53)
196 Reallocated_Event_Count -O--CK   100   100   000    -    0
197 Current_Pending_Sector  -O--CK   100   100   000    -    1128
199 UDMA_CRC_Error_Count    -O--CK   200   200   000    -    0
                            ||||||_ K auto-keep
                            |||||__ C event count
                            ||||___ R error rate
                            |||____ S speed/performance
                            ||_____ O updated online
                            |______ P prefailure warning

General Purpose Log Directory Version 1
SMART           Log Directory Version 1 [multi-sector log support]
Address    Access  R/W   Size  Description
0x00       GPL,SL  R/O      1  Log Directory
0x01           SL  R/O      1  Summary SMART error log
0x02           SL  R/O     51  Comprehensive SMART error log
0x03       GPL     R/O     64  Ext. Comprehensive SMART error log
0x04       GPL,SL  R/O      8  Device Statistics log
0x06           SL  R/O      1  SMART self-test log
0x07       GPL     R/O      1  Extended self-test log
0x09           SL  R/W      1  Selective self-test log
0x10       GPL     R/O      1  NCQ Command Error log
0x11       GPL     R/O      1  SATA Phy Event Counters log
0x80-0x9f  GPL,SL  R/W     16  Host vendor specific log
0xb6       GPL     VS    8191  Device vendor specific log
0xe0       GPL,SL  R/W      1  SCT Command/Status
0xe1       GPL,SL  R/W      1  SCT Data Transfer

SMART Extended Comprehensive Error Log Version: 1 (64 sectors)
Device Error Count: 383 (device log contains only the most recent 256 errors)
	CR     = Command Register
	FEATR  = Features Register
	COUNT  = Count (was: Sector Count) Register
	LBA_48 = Upper bytes of LBA High/Mid/Low Registers ]  ATA-8
	LH     = LBA High (was: Cylinder High) Register    ]   LBA
	LM     = LBA Mid (was: Cylinder Low) Register      ] Register
	LL     = LBA Low (was: Sector Number) Register     ]
	DV     = Device (was: Device/Head) Register
	DC     = Device Control Register
	ER     = Error register
	ST     = Status register
Powered_Up_Time is measured from power on, and printed as
DDd+hh:mm:SS.sss where DD=days, hh=hours, mm=minutes,
SS=sec, and sss=millisec. It "wraps" after 49.710 days.

Error 383 [126] occurred at disk power-on lifetime: 16357 hours (681 days + 13 hours)
  When the command that caused the error occurred, the device was active or idle.

  After command completion occurred, registers were:
  ER -- ST COUNT  LBA_48  LH LM LL DV DC
  -- -- -- == -- == == == -- -- -- -- --
  40 -- 41 00 08 00 00 06 e8 68 f8 40 00  Error: WP at LBA = 0x06e868f8 = 115894520

  Commands leading to the command that caused the error were:
  CR FEATR COUNT  LBA_48  LH LM LL DV DC  Powered_Up_Time  Command/Feature_Name
  -- == -- == -- == == == -- -- -- -- --  ---------------  --------------------
  61 00 08 00 60 00 00 03 60 27 20 40 00     01:38:49.107  WRITE FPDMA QUEUED
  61 00 a0 00 40 00 00 1f f5 ab 20 40 00     01:38:49.107  WRITE FPDMA QUEUED
  61 00 08 00 58 00 00 03 60 11 00 40 00     01:38:49.107  WRITE FPDMA QUEUED
  60 00 08 00 08 00 00 06 e8 68 f8 40 00     01:38:49.107  READ FPDMA QUEUED
  61 03 00 00 30 00 00 19 0c ec 98 40 00     01:38:49.106  WRITE FPDMA QUEUED

Error 382 [125] occurred at disk power-on lifetime: 16357 hours (681 days + 13 hours)
  When the command that caused the error occurred, the device was active or idle.

  After command completion occurred, registers were:
  ER -- ST COUNT  LBA_48  LH LM LL DV DC
  -- -- -- == -- == == == -- -- -- -- --
  40 -- 41 00 e8 00 00 06 e8 68 f8 40 00  Error: UNC at LBA = 0x06e868f8 = 115894520

  Commands leading to the command that caused the error were:
  CR FEATR COUNT  LBA_48  LH LM LL DV DC  Powered_Up_Time  Command/Feature_Name
  -- == -- == -- == == == -- -- -- -- --  ---------------  --------------------
  60 00 80 00 f0 00 00 06 e8 69 30 40 00     01:38:48.382  READ FPDMA QUEUED
  60 00 40 00 e8 00 00 06 e8 68 f0 40 00     01:38:45.512  READ FPDMA QUEUED
  60 00 20 00 e0 00 00 06 e8 68 d0 40 00     01:38:45.499  READ FPDMA QUEUED
  60 00 08 00 d8 00 00 06 df 25 60 40 00     01:38:45.437  READ FPDMA QUEUED
  60 00 08 00 d0 00 00 06 de d0 d0 40 00     01:38:45.413  READ FPDMA QUEUED

Error 381 [124] occurred at disk power-on lifetime: 16357 hours (681 days + 13 hours)
  When the command that caused the error occurred, the device was active or idle.

  After command completion occurred, registers were:
  ER -- ST COUNT  LBA_48  LH LM LL DV DC
  -- -- -- == -- == == == -- -- -- -- --
  40 -- 41 00 18 00 00 17 67 c0 e8 40 00  Error: WP at LBA = 0x1767c0e8 = 392675560

  Commands leading to the command that caused the error were:
  CR FEATR COUNT  LBA_48  LH LM LL DV DC  Powered_Up_Time  Command/Feature_Name
  -- == -- == -- == == == -- -- -- -- --  ---------------  --------------------
  61 00 58 00 28 00 00 1f f3 65 70 40 00     01:32:49.604  WRITE FPDMA QUEUED
  61 00 c8 00 20 00 00 12 13 d8 00 40 00     01:32:49.603  WRITE FPDMA QUEUED
  60 00 08 00 18 00 00 17 67 c0 e8 40 00     01:32:47.736  READ FPDMA QUEUED
  60 00 08 00 10 00 00 17 67 af 20 40 00     01:32:47.735  READ FPDMA QUEUED
  60 00 08 00 08 00 00 17 67 bc f8 40 00     01:32:47.725  READ FPDMA QUEUED

Error 380 [123] occurred at disk power-on lifetime: 16357 hours (681 days + 13 hours)
  When the command that caused the error occurred, the device was active or idle.

  After command completion occurred, registers were:
  ER -- ST COUNT  LBA_48  LH LM LL DV DC
  -- -- -- == -- == == == -- -- -- -- --
  40 -- 41 00 28 00 00 17 67 c0 e8 40 00  Error: UNC at LBA = 0x1767c0e8 = 392675560

  Commands leading to the command that caused the error were:
  CR FEATR COUNT  LBA_48  LH LM LL DV DC  Powered_Up_Time  Command/Feature_Name
  -- == -- == -- == == == -- -- -- -- --  ---------------  --------------------
  60 00 08 00 98 00 00 17 67 b4 78 40 00     01:32:42.072  READ FPDMA QUEUED
  60 00 10 00 90 00 00 17 67 b2 28 40 00     01:32:42.072  READ FPDMA QUEUED
  60 00 08 00 88 00 00 17 67 b1 e8 40 00     01:32:42.072  READ FPDMA QUEUED
  60 00 10 00 78 00 00 17 67 b1 c8 40 00     01:32:42.072  READ FPDMA QUEUED
  61 00 18 00 70 00 00 1f f3 61 00 40 00     01:32:42.048  WRITE FPDMA QUEUED

Error 379 [122] occurred at disk power-on lifetime: 16356 hours (681 days + 12 hours)
  When the command that caused the error occurred, the device was active or idle.

  After command completion occurred, registers were:
  ER -- ST COUNT  LBA_48  LH LM LL DV DC
  -- -- -- == -- == == == -- -- -- -- --
  40 -- 41 00 20 00 00 06 e8 68 e8 40 00  Error: WP at LBA = 0x06e868e8 = 115894504

  Commands leading to the command that caused the error were:
  CR FEATR COUNT  LBA_48  LH LM LL DV DC  Powered_Up_Time  Command/Feature_Name
  -- == -- == -- == == == -- -- -- -- --  ---------------  --------------------
  61 00 08 00 28 00 00 02 e7 30 50 40 00     01:12:37.427  WRITE FPDMA QUEUED
  60 00 08 00 20 00 00 06 e8 68 e8 40 00     01:12:37.427  READ FPDMA QUEUED
  ea 00 00 00 00 00 00 00 00 00 00 a0 00     01:12:35.815  FLUSH CACHE EXT
  61 00 10 00 10 00 00 02 e7 30 40 40 00     01:12:34.890  WRITE FPDMA QUEUED
  60 00 08 00 98 00 00 06 e8 68 e0 40 00     01:12:34.721  READ FPDMA QUEUED

Error 378 [121] occurred at disk power-on lifetime: 16356 hours (681 days + 12 hours)
  When the command that caused the error occurred, the device was active or idle.

  After command completion occurred, registers were:
  ER -- ST COUNT  LBA_48  LH LM LL DV DC
  -- -- -- == -- == == == -- -- -- -- --
  40 -- 41 00 60 00 00 03 a0 21 78 40 00  Error: WP at LBA = 0x03a02178 = 60825976

  Commands leading to the command that caused the error were:
  CR FEATR COUNT  LBA_48  LH LM LL DV DC  Powered_Up_Time  Command/Feature_Name
  -- == -- == -- == == == -- -- -- -- --  ---------------  --------------------
  61 00 28 00 70 00 00 02 e5 5c a8 40 00     01:09:35.159  WRITE FPDMA QUEUED
  60 00 08 00 68 00 00 03 a0 21 08 40 00     01:09:32.172  READ FPDMA QUEUED
  60 00 f8 00 60 00 00 03 a0 21 10 40 00     01:09:32.172  READ FPDMA QUEUED
  60 00 08 00 58 00 00 03 a1 2c f0 40 00     01:09:32.172  READ FPDMA QUEUED
  60 00 08 00 50 00 00 03 a1 2c e8 40 00     01:09:32.172  READ FPDMA QUEUED

Error 377 [120] occurred at disk power-on lifetime: 16356 hours (681 days + 12 hours)
  When the command that caused the error occurred, the device was active or idle.

  After command completion occurred, registers were:
  ER -- ST COUNT  LBA_48  LH LM LL DV DC
  -- -- -- == -- == == == -- -- -- -- --
  40 -- 41 00 00 00 00 06 e8 68 e0 40 00  Error: WP at LBA = 0x06e868e0 = 115894496

  Commands leading to the command that caused the error were:
  CR FEATR COUNT  LBA_48  LH LM LL DV DC  Powered_Up_Time  Command/Feature_Name
  -- == -- == -- == == == -- -- -- -- --  ---------------  --------------------
  61 00 18 00 f0 00 00 06 61 43 c0 40 00     01:03:53.037  WRITE FPDMA QUEUED
  61 00 08 00 e8 00 00 06 65 01 80 40 00     01:03:53.037  WRITE FPDMA QUEUED
  61 00 88 00 e0 00 00 06 65 00 00 40 00     01:03:53.037  WRITE FPDMA QUEUED
  61 02 c0 00 d8 00 00 06 65 01 88 40 00     01:03:53.037  WRITE FPDMA QUEUED
  61 00 08 00 d0 00 00 1a 7a 98 30 40 00     01:03:53.037  WRITE FPDMA QUEUED

Error 376 [119] occurred at disk power-on lifetime: 16356 hours (681 days + 12 hours)
  When the command that caused the error occurred, the device was active or idle.

  After command completion occurred, registers were:
  ER -- ST COUNT  LBA_48  LH LM LL DV DC
  -- -- -- == -- == == == -- -- -- -- --
  40 -- 41 00 e8 00 00 06 e8 68 e0 40 00  Error: WP at LBA = 0x06e868e0 = 115894496

  Commands leading to the command that caused the error were:
  CR FEATR COUNT  LBA_48  LH LM LL DV DC  Powered_Up_Time  Command/Feature_Name
  -- == -- == -- == == == -- -- -- -- --  ---------------  --------------------
  61 00 88 00 f0 00 00 1f f1 da 50 40 00     01:03:05.553  WRITE FPDMA QUEUED
  60 00 08 00 e8 00 00 06 e8 68 e0 40 00     01:03:05.553  READ FPDMA QUEUED
  61 02 f8 00 e0 00 00 2a f0 a0 00 40 00     01:03:05.553  WRITE FPDMA QUEUED
  ea 00 00 00 00 00 00 00 00 00 00 a0 00     01:03:05.494  FLUSH CACHE EXT
  60 00 08 00 78 00 00 06 e8 68 d8 40 00     01:03:04.547  READ FPDMA QUEUED

SMART Extended Self-test Log Version: 1 (1 sectors)
Num  Test_Description    Status                  Remaining  LifeTime(hours)  LBA_of_first_error
# 1  Short offline       Completed: read failure       90%     15611         55210920
# 2  Short offline       Completed without error       00%     13077         -
# 3  Short offline       Completed without error       00%     13067         -
# 4  Short offline       Completed without error       00%     13061         -
# 5  Short offline       Completed without error       00%     13052         -
# 6  Short offline       Completed without error       00%     13043         -

SMART Selective self-test log data structure revision number 1
 SPAN  MIN_LBA  MAX_LBA  CURRENT_TEST_STATUS
    1        0        0  Not_testing
    2        0        0  Not_testing
    3        0        0  Not_testing
    4        0        0  Not_testing
    5        0        0  Not_testing
Selective self-test flags (0x0):
  After scanning selected spans, do NOT read-scan remainder of disk.
If Selective self-test is pending on power-up, resume after 0 minute delay.

SCT Status Version:                  2
SCT Version (vendor specific):       1 (0x0001)
Device State:                        Active (0)
Current Temperature:                    46 Celsius
Power Cycle Min/Max Temperature:     40/48 Celsius
Lifetime    Min/Max Temperature:     15/62 Celsius
Under/Over Temperature Limit Count:   0/53

SCT Temperature History Version:     2
Temperature Sampling Period:         1 minute
Temperature Logging Interval:        1 minute
Min/Max recommended Temperature:      0/60 Celsius
Min/Max Temperature Limit:            0/60 Celsius
Temperature History Size (Index):    478 (217)

Index    Estimated Time   Temperature Celsius
 218    2025-03-15 15:11    41  **********************
 ...    ..(  7 skipped).    ..  **********************
 226    2025-03-15 15:19    41  **********************
 227    2025-03-15 15:20    40  *********************
 ...    ..(  7 skipped).    ..  *********************
 235    2025-03-15 15:28    40  *********************
 236    2025-03-15 15:29    39  ********************
 237    2025-03-15 15:30    39  ********************
 238    2025-03-15 15:31    40  *********************
 239    2025-03-15 15:32    40  *********************
 240    2025-03-15 15:33    40  *********************
 241    2025-03-15 15:34    39  ********************
 ...    ..( 10 skipped).    ..  ********************
 252    2025-03-15 15:45    39  ********************
 253    2025-03-15 15:46    40  *********************
 ...    ..( 11 skipped).    ..  *********************
 265    2025-03-15 15:58    40  *********************
 266    2025-03-15 15:59    41  **********************
 ...    ..(  5 skipped).    ..  **********************
 272    2025-03-15 16:05    41  **********************
 273    2025-03-15 16:06    40  *********************
 274    2025-03-15 16:07    41  **********************
 275    2025-03-15 16:08    40  *********************
 ...    ..(  6 skipped).    ..  *********************
 282    2025-03-15 16:15    40  *********************
 283    2025-03-15 16:16    39  ********************
 284    2025-03-15 16:17    40  *********************
 ...    ..(  3 skipped).    ..  *********************
 288    2025-03-15 16:21    40  *********************
 289    2025-03-15 16:22    39  ********************
 ...    ..( 27 skipped).    ..  ********************
 317    2025-03-15 16:50    39  ********************
 318    2025-03-15 16:51    38  *******************
 ...    ..( 24 skipped).    ..  *******************
 343    2025-03-15 17:16    38  *******************
 344    2025-03-15 17:17    39  ********************
 ...    ..(122 skipped).    ..  ********************
 467    2025-03-15 19:20    39  ********************
 468    2025-03-15 19:21    40  *********************
 469    2025-03-15 19:22    41  **********************
 470    2025-03-15 19:23    41  **********************
 471    2025-03-15 19:24    42  ***********************
 472    2025-03-15 19:25    43  ************************
 473    2025-03-15 19:26    42  ***********************
 474    2025-03-15 19:27    42  ***********************
 475    2025-03-15 19:28    42  ***********************
 476    2025-03-15 19:29    41  **********************
 ...    ..(  2 skipped).    ..  **********************
   1    2025-03-15 19:32    41  **********************
   2    2025-03-15 19:33    42  ***********************
   3    2025-03-15 19:34    42  ***********************
   4    2025-03-15 19:35    42  ***********************
   5    2025-03-15 19:36    41  **********************
 ...    ..( 14 skipped).    ..  **********************
  20    2025-03-15 19:51    41  **********************
  21    2025-03-15 19:52    40  *********************
 ...    ..(  4 skipped).    ..  *********************
  26    2025-03-15 19:57    40  *********************
  27    2025-03-15 19:58    39  ********************
 ...    ..( 10 skipped).    ..  ********************
  38    2025-03-15 20:09    39  ********************
  39    2025-03-15 20:10    40  *********************
  40    2025-03-15 20:11    40  *********************
  41    2025-03-15 20:12    40  *********************
  42    2025-03-15 20:13    41  **********************
 ...    ..(  3 skipped).    ..  **********************
  46    2025-03-15 20:17    41  **********************
  47    2025-03-15 20:18    42  ***********************
  48    2025-03-15 20:19    43  ************************
  49    2025-03-15 20:20    44  *************************
  50    2025-03-15 20:21    44  *************************
  51    2025-03-15 20:22    44  *************************
  52    2025-03-15 20:23    43  ************************
  53    2025-03-15 20:24    43  ************************
  54    2025-03-15 20:25    43  ************************
  55    2025-03-15 20:26    42  ***********************
 ...    ..(  3 skipped).    ..  ***********************
  59    2025-03-15 20:30    42  ***********************
  60    2025-03-15 20:31    41  **********************
 ...    ..( 25 skipped).    ..  **********************
  86    2025-03-15 20:57    41  **********************
  87    2025-03-15 20:58    40  *********************
 ...    ..(  2 skipped).    ..  *********************
  90    2025-03-15 21:01    40  *********************
  91    2025-03-15 21:02    41  **********************
  92    2025-03-15 21:03    41  **********************
  93    2025-03-15 21:04    41  **********************
  94    2025-03-15 21:05    42  ***********************
 ...    ..(  2 skipped).    ..  ***********************
  97    2025-03-15 21:08    42  ***********************
  98    2025-03-15 21:09    43  ************************
  99    2025-03-15 21:10    43  ************************
 100    2025-03-15 21:11    42  ***********************
 101    2025-03-15 21:12    42  ***********************
 102    2025-03-15 21:13    41  **********************
 103    2025-03-15 21:14    41  **********************
 104    2025-03-15 21:15    41  **********************
 105    2025-03-15 21:16     ?  -
 106    2025-03-15 21:17    44  *************************
 107    2025-03-15 21:18    45  **************************
 108    2025-03-15 21:19    45  **************************
 109    2025-03-15 21:20    44  *************************
 ...    ..(  3 skipped).    ..  *************************
 113    2025-03-15 21:24    44  *************************
 114    2025-03-15 21:25    43  ************************
 115    2025-03-15 21:26     ?  -
 116    2025-03-15 21:27    46  ***************************
 ...    ..(  2 skipped).    ..  ***************************
 119    2025-03-15 21:30    46  ***************************
 120    2025-03-15 21:31    45  **************************
 121    2025-03-15 21:32    45  **************************
 122    2025-03-15 21:33    46  ***************************
 123    2025-03-15 21:34    46  ***************************
 124    2025-03-15 21:35    46  ***************************
 125    2025-03-15 21:36    45  **************************
 126    2025-03-15 21:37    44  *************************
 127    2025-03-15 21:38    44  *************************
 128    2025-03-15 21:39    43  ************************
 129    2025-03-15 21:40    43  ************************
 130    2025-03-15 21:41    43  ************************
 131    2025-03-15 21:42    42  ***********************
 132    2025-03-15 21:43    42  ***********************
 133    2025-03-15 21:44    41  **********************
 ...    ..(  5 skipped).    ..  **********************
 139    2025-03-15 21:50    41  **********************
 140    2025-03-15 21:51    40  *********************
 141    2025-03-15 21:52    41  **********************
 ...    ..(  4 skipped).    ..  **********************
 146    2025-03-15 21:57    41  **********************
 147    2025-03-15 21:58    42  ***********************
 148    2025-03-15 21:59    42  ***********************
 149    2025-03-15 22:00    43  ************************
 ...    ..(  5 skipped).    ..  ************************
 155    2025-03-15 22:06    43  ************************
 156    2025-03-15 22:07    44  *************************
 157    2025-03-15 22:08    44  *************************
 158    2025-03-15 22:09    44  *************************
 159    2025-03-15 22:10    45  **************************
 160    2025-03-15 22:11    45  **************************
 161    2025-03-15 22:12    46  ***************************
 ...    ..( 11 skipped).    ..  ***************************
 173    2025-03-15 22:24    46  ***************************
 174    2025-03-15 22:25    47  ****************************
 175    2025-03-15 22:26    47  ****************************
 176    2025-03-15 22:27    47  ****************************
 177    2025-03-15 22:28    48  *****************************
 ...    ..(  7 skipped).    ..  *****************************
 185    2025-03-15 22:36    48  *****************************
 186    2025-03-15 22:37    47  ****************************
 ...    ..( 17 skipped).    ..  ****************************
 204    2025-03-15 22:55    47  ****************************
 205    2025-03-15 22:56    46  ***************************
 206    2025-03-15 22:57    46  ***************************
 207    2025-03-15 22:58    46  ***************************
 208    2025-03-15 22:59    45  **************************
 209    2025-03-15 23:00    44  *************************
 210    2025-03-15 23:01    45  **************************
 ...    ..(  4 skipped).    ..  **************************
 215    2025-03-15 23:06    45  **************************
 216    2025-03-15 23:07    46  ***************************
 217    2025-03-15 23:08    46  ***************************

SCT Error Recovery Control:
           Read: Disabled
          Write: Disabled

Device Statistics (GP Log 0x04)
Page  Offset Size        Value Flags Description
0x01  =====  =               =  ===  == General Statistics (rev 2) ==
0x01  0x008  4            3796  ---  Lifetime Power-On Resets
0x01  0x010  4           16357  ---  Power-on Hours
0x01  0x018  6    152409496471  ---  Logical Sectors Written
0x01  0x020  6      2806444238  ---  Number of Write Commands
0x01  0x028  6     90580260621  ---  Logical Sectors Read
0x01  0x030  6      3401304174  ---  Number of Read Commands
0x02  =====  =               =  ===  == Free-Fall Statistics (rev 1) ==
0x02  0x010  4            1891  ---  Overlimit Shock Events
0x03  =====  =               =  ===  == Rotating Media Statistics (rev 1) ==
0x03  0x008  4           16352  ---  Spindle Motor Power-on Hours
0x03  0x010  4           15688  ---  Head Flying Hours
0x03  0x018  4          107870  ---  Head Load Events
0x03  0x020  4             400  ---  Number of Reallocated Logical Sectors
0x03  0x028  4            1722  ---  Read Recovery Attempts
0x03  0x030  4               0  ---  Number of Mechanical Start Failures
0x04  =====  =               =  ===  == General Errors Statistics (rev 1) ==
0x04  0x008  4             383  ---  Number of Reported Uncorrectable Errors
0x04  0x010  4               1  ---  Resets Between Cmd Acceptance and Completion
0x05  =====  =               =  ===  == Temperature Statistics (rev 1) ==
0x05  0x008  1              46  ---  Current Temperature
0x05  0x010  1              41  N--  Average Short Term Temperature
0x05  0x018  1              36  N--  Average Long Term Temperature
0x05  0x020  1              62  ---  Highest Temperature
0x05  0x028  1              15  ---  Lowest Temperature
0x05  0x030  1              46  N--  Highest Average Short Term Temperature
0x05  0x038  1              32  N--  Lowest Average Short Term Temperature
0x05  0x040  1              41  N--  Highest Average Long Term Temperature
0x05  0x048  1              34  N--  Lowest Average Long Term Temperature
0x05  0x050  4              53  ---  Time in Over-Temperature
0x05  0x058  1              60  ---  Specified Maximum Operating Temperature
0x05  0x060  4               0  ---  Time in Under-Temperature
0x05  0x068  1               0  ---  Specified Minimum Operating Temperature
0x06  =====  =               =  ===  == Transport Statistics (rev 1) ==
0x06  0x008  4            3495  ---  Number of Hardware Resets
0x06  0x018  4               0  ---  Number of Interface CRC Errors
0x07  =====  =               =  ===  == Solid State Device Statistics (rev 1) ==
0x07  0x008  1              27  N--  Percentage Used Endurance Indicator
                                |||_ C monitored condition met
                                ||__ D supports DSN
                                |___ N normalized value

Pending Defects log (GP Log 0x0c) not supported

SATA Phy Event Counters (GP Log 0x11)
ID      Size     Value  Description
0x0001  4            0  Command failed due to ICRC error
0x0002  4            0  R_ERR response for data FIS
0x0003  4            0  R_ERR response for device-to-host data FIS
0x0004  4            0  R_ERR response for host-to-device data FIS
0x0005  4            0  R_ERR response for non-data FIS
0x0006  4            0  R_ERR response for device-to-host non-data FIS
0x0007  4            0  R_ERR response for host-to-device non-data FIS
0x0008  4            0  Device-to-host non-data FIS retries
0x0009  4        34251  Transition from drive PhyRdy to drive PhyNRdy
0x000a  4            2  Device-to-host register FISes sent due to a COMRESET
0x000b  4            0  CRC errors within host-to-device FIS
0x000d  4            0  Non-CRC errors within host-to-device FIS
0x000f  4            0  R_ERR response for host-to-device data FIS, CRC
0x0010  4            0  R_ERR response for host-to-device data FIS, non-CRC
0x0012  4            0  R_ERR response for host-to-device non-data FIS, CRC
0x0013  4            0  R_ERR response for host-to-device non-data FIS, non-CRC

